"If one synchronized swimmer drowns, do the rest have to drown too?"
"Help Wanted: Telepath; you know where to apply."
"Look out for #1, and don't step in #2, either."
"Department of Redundancy Department"
"""If the shoe fits, buy it."" - Imelda Marcos"
"It's sad how whole families are torn apart by simple things, like wild dogs."
"Karaoke is Japanese for ""tone deaf""."
"3 out of 4 Americans make up 75% of the population."
"A day for firm decisions! Or is it?"
"A day without radiation is a day without sunshine."
"A day without sunshine is like night."
"A seminar on time travel will be held two weeks ago."
"Alzheimer's advantage: New friends every day."
"An unbreakable toy is useful for breaking other toys."
"An unemployed court jester is no one's fool."
"Any closet is a walk-in closet if you try hard enough."
"As I said before, I never repeat myself."
"As long as I can remember, I've had amnesia."
"Bigamy: one wife too many. Monogamy: same thing"
"Bombs don't kill people, explosions kill people."
"Bureaucrats cut red tape, lengthwise."
"Circular Definition: see Definition, Circular."
"Clairvoyants meeting canceled due to unforeseen events."
"Clones are people two."
"Cole's Law: Thinly sliced cabbage."
"Confucius say: Those who quote me are fools."
"Did you hear? They took the word gullible out of the dictionary!"
"Do not put statements in the negative form."
"Doesn't expecting the unexpected make the unexpected become the expected?"
"Don't be a sexist, broads hate that."
"If you try to fail, and succeed, which have you done?"
"Friction can be a drag sometimes."
"Geez if you believe in honkus."
"He's a graduate of The Uncle Fester & Keith Moon School of hair styling."
"Have you seen Quasimodo? I have a hunch he's back!"
"Help stamp out, eliminate and abolish redundancy!"
"Honk if you love peace and quiet."
"How many of you believe in telekinesis? Raise MY hand!"
"Hypochondria is the only disease I haven't got."
"I bet you I could stop gambling."
"I couldn't care less about apathy."
"I got arrested in LA and boy am I beat!"
"Drilling for oil is boring."
"Energizer Bunny Arrested; charged with battery."
"I like kids, but I don't think I could eat a whole one."
"I tried to daydream, but my mind kept wandering."
"I used to be indecisive, now I'm not so sure."
"I used to be schizophrenic, but we're all right now."
"I wouldn't touch the metric system with a 3.048m pole!"
"I've got a mind like a.. a.. what's that thing called?"
"What has four legs and an arm? A happy pit bull."
"If evolution is outlawed, only outlaws will evolve."
"We are all prawns in the game of life."
"my not by GOD"
